<?xml version="1.0" encoding="UTF-8"?>
<DatosFederales xmlns:xsi="http://www.w3.org/2001/XMLSchema-instance"
 xsi:noNamespaceSchemaLocation="sospechosos.xsd">
	<Sospechoso ficha="LLF455" estado="TX" nombreEstado="TEXAS">
		<Nombre>Jhon Carpenter</Nombre>
		<Sexo>Varón</Sexo>
		<Altura>172</Altura>
		<Peso>78</Peso>
		<FechaNacimiento>1968/10/03</FechaNacimiento>
		<Foto>jhon-carpenter</Foto>
		<Delito>
			<Fecha>2006-03-11T01:12:00</Fecha>
			<Tipo>Asesinato</Tipo>
			<Observaciones><![CDATA[Sospechoso del asesinato de varias prostitutas en el área de Jalisco en el bienio 2005-2006]]></Observaciones>
		</Delito>
	</Sospechoso>
	<Sospechoso ficha="LLJ466" estado="LA" nombreEstado="LOS ANGELES">
		<Nombre>Malcon Mann</Nombre>
		<Sexo>Varón</Sexo>
		<Altura>178</Altura>
		<Peso>85</Peso>
		<FechaNacimiento>1972/02/15</FechaNacimiento>
		<Foto>malcon-mann</Foto>
		<Delito>
			<Fecha>2012-10-05T17:15:00</Fecha>
			<Tipo>Pedarastia</Tipo>
			<Observaciones><![CDATA[Acusado de la distribución de pornografía infantil]]></Observaciones>
		</Delito>
	</Sospechoso>
	<Sospechoso ficha="LLC223" estado="NM" nombreEstado="MINNESOTA">
		<Nombre>Panchi Martínez Arévalo</Nombre>
		<Sexo>Varón</Sexo>
		<Altura>168</Altura>
		<Peso>78</Peso>
		<FechaNacimiento>1978/11/06</FechaNacimiento>
		<Foto>panchi-martinez</Foto>		
		<Delito>
			<Fecha>2018-08-15T17:15:00</Fecha>
			<Tipo>Inmigración</Tipo>
			<Observaciones><![CDATA[Líder de una red de inmigración ilegal]]></Observaciones>
		</Delito>
	</Sospechoso>
	<Sospechoso ficha="LLJ466" estado="LA" nombreEstado="LOS ANGELES">
		<Nombre>Malcon Mann</Nombre>
		<Sexo>Varón</Sexo>
		<Altura>178</Altura>
		<Peso>85</Peso>
		<FechaNacimiento>1972/02/15</FechaNacimiento>
		<Foto>malcon-mann</Foto>
		<Delito>
			<Fecha>2018-01-05T13:15:00</Fecha>
			<Tipo>Pedarastia</Tipo>
			<Observaciones><![CDATA[Tenencia de material fotográfico]]></Observaciones>
		</Delito>
	</Sospechoso>
</DatosFederales>